publication_external_id,criteria,explanation,recommendation,total,score
oARTT6bvyALY,rag_implementation,"The article does not provide any content or sections that demonstrate the implementation of Retrieval-Augmented Generation (RAG) architecture. There are no references to document retrieval, LLM generation, or vector storage, which are essential components of RAG.","To improve the article, the authors should include detailed descriptions of the RAG implementation, including methodologies, technologies used, and examples of how retrieval and generation are integrated.",1,0
oARTT6bvyALY,embedding_model_selection,"The article does not provide any information regarding the embedding model used, its selection rationale, or its capabilities. Without these critical details, it fails to meet the criterion for embedding model selection and configuration.","To improve the article, it should include specific details about the embedding model, explain why it was chosen, and describe its capabilities.",1,0
oARTT6bvyALY,agentic_patterns_implementation,"The article does not contain any content that demonstrates the use of agentic patterns or frameworks. There are no structured reasoning patterns or systematic frameworks mentioned, which are essential for meeting the criterion.","To improve the article, it is recommended to include discussions on structured reasoning patterns and frameworks that align with the criterion requirements.",1,0
oARTT6bvyALY,guardrails_implementation,"The article does not contain any content related to Guardrails and Safety Measures. There are no sections discussing safety protocols, content filtering, or input validation, which are essential for meeting this criterion.","To improve the article, it is crucial to include detailed information on safety measures, such as guardrails, content filtering mechanisms, and any other relevant safety considerations.",1,0
oARTT6bvyALY,chunk_overlap_strategy,"The article does not address the criterion of 'Chunk Overlap and Context Preservation' at all. There are no sections or paragraphs that discuss chunk overlap strategies, parameters, rationale, or configuration documentation. Therefore, it fails to meet the necessary requirements for this criterion.","To improve the article, the authors should include detailed discussions on chunk overlap strategies, specify overlap parameters, explain the rationale behind the chosen overlap, and document how the overlap is configured.",1,0
oARTT6bvyALY,project_scope_clarity,"The article does not provide any specific details or sections that define the RAG assistant's implementation, intended use case, document domain, basic functionality, knowledge base, or the types of questions it can answer. Without this critical information, it fails to meet the criterion for RAG Project Scope Definition.","To improve the article, the authors should include comprehensive sections that clearly outline the RAG assistant's scope, including its intended applications and functionalities.",1,0
oARTT6bvyALY,document_ingestion_process,"The article does not provide any information regarding the document ingestion and processing criteria. There are no sections that discuss document selection, preprocessing steps, chunking strategies, or embedding generation, which are essential for meeting the criterion.","To improve the article, it should include comprehensive details on the document ingestion and processing steps, ensuring that all relevant aspects are covered.",1,0
oARTT6bvyALY,memory_and_reasoning,"The article does not provide any information regarding the implementation of memory mechanisms or reasoning capabilities in the RAG assistant. There are no discussions on how conversation history is managed or how context is maintained, which are essential for meeting the criterion.","To improve the article, the authors should include detailed sections on memory management and reasoning strategies used in the RAG assistant. This should cover how the assistant retains context across interactions and any multi-step reasoning processes.",1,0
oARTT6bvyALY,rag_architecture_explanation,"The article does not provide any paragraphs or content that detail the RAG architecture implementation, including the retrieval mechanism, vector store choice, and document processing. Without this critical information, it cannot be determined that the article meets the criterion.","To improve the article, the authors should include comprehensive sections that explain the RAG architecture, detailing the retrieval mechanism, the choice of vector store, and the document processing steps.",1,0
oARTT6bvyALY,similarity_search_configuration,"The article does not contain any relevant content discussing similarity search mechanisms for document retrieval. There are no mentions of similarity metrics, search algorithms, or parameters, which are essential for meeting the criterion.","To improve the article, the authors should include detailed discussions on similarity search mechanisms, including relevant metrics and algorithms, to ensure compliance with the criterion.",1,0
oARTT6bvyALY,model_selection,"The article does not provide any information regarding the selection of a language model for response generation in the RAG pipeline. There are no details about the specific LLM used, the rationale behind its selection, or any documentation of its capabilities. This lack of content directly leads to a failure to meet the criterion.","To improve the article, it is essential to include a section that discusses the language model chosen for the RAG assistant, the reasons for its selection, and an overview of its capabilities. This will help fulfill the requirements of the criterion.",1,0
oARTT6bvyALY,vector_store_implementation,"The article does not provide any paragraphs or information regarding the vector store selection and configuration, which is essential for meeting the criterion. Without this critical information, it is impossible to assess the effectiveness or appropriateness of the vector store used in the RAG system.","To improve the article, it is necessary to include detailed sections that discuss the vector store chosen for the RAG system, the reasons for its selection, and any relevant configuration settings. This will help fulfill the requirements of the criterion.",1,0
DUiPV8B0Swzl,guardrails_implementation,"The article does not address any safety guardrails or content filtering mechanisms, which are essential for meeting the criterion. There are no mentions of input validation, content moderation, or any safety considerations implemented in the RAG assistant system.","To improve the article, it should include sections that discuss safety measures such as input validation, query filtering, and strategies to prevent harmful outputs.",1,0
DUiPV8B0Swzl,memory_and_reasoning,"The article does not provide any information regarding the implementation of memory mechanisms or reasoning capabilities in the RAG assistant. There are no discussions on conversation history management, context persistence, or multi-step reasoning approaches, which are essential for meeting the criterion.","To improve the article, the authors should include detailed sections that explain how memory and reasoning are implemented in the RAG assistant. This should cover aspects such as how conversation history is managed and how context is maintained across interactions.",1,0
DUiPV8B0Swzl,prompt_engineering_implementation,"The article does not provide any examples or sections that demonstrate effective prompt engineering. There are no prompt templates, context integration from retrieved documents, or documentation of prompt design strategies present in the text. Without these elements, it fails to meet the criterion for Clear Prompt Engineering Implementation.","To improve the article, the authors should include specific examples of prompt engineering techniques, such as detailed prompt templates and explanations of how context from retrieved documents is integrated into the prompts.",1,0
DUiPV8B0Swzl,embedding_model_selection,"The article successfully identifies and names the specific embedding model used, which is a requirement of the criterion. It also provides a rationale for the choice of the model, discussing its capabilities such as automatic device selection for optimal performance. This demonstrates a clear understanding of embedding model selection and configuration.","Continue to provide detailed explanations of model choices in future articles, as this adds value and clarity for readers.",1,1
DUiPV8B0Swzl,text_chunking_strategy,"The article provides a comprehensive overview of the text chunking strategy implemented within the RAG system. It specifies the chunk size and overlap parameters, allowing users to customize their settings. Additionally, it describes the chunking method, including the use of flexible separators and metadata preservation, which are essential for effective text processing. The inclusion of implementation details, such as the `process_documents` method, further supports the thoroughness of the approach.",The article meets the criterion for 'Text Chunking Strategy and Implementation' and should be considered compliant.,1,1
DUiPV8B0Swzl,chunk_overlap_strategy,"The article successfully discusses the concept of configurable chunking, including the ability to specify chunk size and overlap. It clearly defines the overlap in terms of shared characters between chunks, which aligns with the criterion's requirements. Additionally, the rationale for using overlap to optimize LLM context window usage is implied, demonstrating an understanding of its benefits.",The article meets the criterion for 'Chunk Overlap and Context Preservation' and should be considered compliant.,1,1
DUiPV8B0Swzl,rag_implementation,"The article effectively describes the implementation of Retrieval-Augmented Generation (RAG) architecture, detailing the integration of document retrieval and language model generation. It outlines the use of a VectorDB for managing text embeddings and demonstrates context retrieval through vector similarity, fulfilling the requirements of the criterion.",The article should be accepted as it meets the RAG Implementation criterion.,1,1
DUiPV8B0Swzl,project_scope_clarity,"The article clearly defines the RAG assistant implementation, its intended use case, and the knowledge base utilized. It outlines the assistant's capabilities and the specific document domain, which aligns with the requirements of the RAG Project Scope Definition criterion.",The article should be considered compliant with the RAG Project Scope Definition criterion.,1,1
DUiPV8B0Swzl,retrieval_evaluation_metrics,"The article does not provide any information regarding retrieval performance measurement and evaluation approaches. There are no sections discussing retrieval accuracy metrics, performance testing, or evaluation methodologies, which are essential for meeting the criterion.","To improve the article, the authors should include detailed discussions on retrieval performance evaluation, including relevant metrics and methodologies. This addition is crucial for satisfying the criterion.",1,0
DUiPV8B0Swzl,agentic_patterns_implementation,The article fails to demonstrate any understanding or application of advanced agentic patterns or structured reasoning frameworks. It primarily focuses on practical implementation details without addressing the necessary complexity or depth required to meet the criterion.,"To improve the article, the authors should incorporate discussions on structured reasoning patterns, systematic reasoning frameworks, and provide examples of thought-action-observation cycles.",1,0
DUiPV8B0Swzl,model_selection,"The article fails to specify which particular LLM from Hugging Face is being used and does not provide a rationale for the selection of the models mentioned. This lack of detail does not meet the criterion for Model Selection for Response Generation, as it does not adequately inform the reader about the capabilities or reasoning behind the model choice.","Revise the article to include specific details about the LLM used, the rationale for its selection, and a discussion of its capabilities in the context of the RAG pipeline.",1,0
DUiPV8B0Swzl,similarity_search_configuration,"The article effectively discusses the mechanisms of similarity search for document retrieval, including the use of vector similarity metrics and the specific search algorithm 'VectorDB.search'. It also outlines the basic parameters necessary for initializing the search process, demonstrating a comprehensive understanding of the topic.",The article meets the criterion for similarity search and retrieval configuration. It should be considered compliant.,1,1
DUiPV8B0Swzl,vector_store_implementation,"The article successfully names ChromaDB as the vector store used in the RAG system and provides a clear rationale for its choice, explaining its role in managing persistent storage and retrieval of text embeddings. It also details the configuration process, including initialization and document insertion, demonstrating a solid understanding of the vector store's purpose in semantic search.",Continue to provide detailed explanations and practical examples in future articles to enhance reader understanding.,1,1
DUiPV8B0Swzl,query_processing_optimization,"The article does not adequately address the necessary components of query processing and optimization. It lacks explicit mentions of query preprocessing, validation, and transformation techniques, which are essential for meeting the criterion. While it does describe a method for semantic search, this alone is insufficient to fulfill the requirements of the criterion.","To improve the article, the authors should include detailed descriptions of query preprocessing strategies, validation methods, and optimization techniques to better align with the criterion.",1,0
DUiPV8B0Swzl,document_ingestion_process,"The article provides a thorough overview of the document ingestion and processing methods, detailing the roles of the `TextChunker` and `VectorDB`. It covers essential aspects such as document selection, preprocessing steps, chunking strategy, and embedding generation, which are critical for meeting the criterion.",The article meets the criterion for Document Ingestion and Processing and is recommended for further dissemination.,1,1
DUiPV8B0Swzl,rag_architecture_explanation,"The article provides a detailed overview of the RAG architecture, specifically focusing on the implementation of the `TextChunker` and `VectorDB` classes. It effectively describes the document processing, the choice of vector store, the embedding model, and the retrieval mechanism, all of which are essential components of the RAG architecture.",The article meets the criterion for RAG Architecture Implementation Details and is recommended for publication.,1,1
BpryDLtWHWkx,chunk_overlap_strategy,"The article does not address the criterion of 'Chunk Overlap and Context Preservation' at all. There are no sections or paragraphs that discuss chunk overlap strategies, parameters, or rationale, which are essential for meeting this criterion.","To improve the article, the authors should include a detailed discussion on chunk overlap strategies, their implementation, and how they ensure context preservation across document segments.",1,0
BpryDLtWHWkx,retrieval_evaluation_metrics,"The article does not provide any information or sections that address the criterion of Retrieval Performance Evaluation and Metrics. There are no discussions on retrieval accuracy, performance testing, or evaluation methodologies, which are essential for meeting this criterion.","To improve the article, the authors should include a dedicated section that outlines the retrieval performance evaluation methods used, along with relevant metrics and results. This addition would help fulfill the criterion and enhance the article's overall quality.",1,0
BpryDLtWHWkx,guardrails_implementation,"The article does not contain any content related to guardrails and safety measures, which are essential for compliance with the criterion. There are no mentions of safety guardrails, content filtering mechanisms, or any basic safety considerations.","It is recommended that the authors revise the article to include sections that address safety measures, input validation, and content filtering mechanisms to meet the criterion.",1,0
BpryDLtWHWkx,query_processing_optimization,"The article effectively discusses the process of converting a user query into an embedding and performing a similarity search, which demonstrates a clear understanding of query preprocessing and enhancement techniques.",The article meets the criterion for Query Processing and Optimization and should be considered compliant.,1,1
BpryDLtWHWkx,vector_store_implementation,"The article clearly mentions the use of ChromaDB as the vector store, provides a rationale for its selection based on fast retrieval capabilities, and details the configuration process for generating vector embeddings using the Google Gemini 2.5 model. Additionally, it explains how user queries are processed and how embeddings are utilized for similarity searches, demonstrating a comprehensive understanding of the vector store's purpose in the RAG system.",The article meets the criterion for Vector Store Selection and Configuration. It is recommended for approval.,1,1
BpryDLtWHWkx,memory_and_reasoning,"The article provides a comprehensive overview of the implementation of memory and reasoning strategies in the RAG based chatbot. It details how conversation history is managed, the persistence of context across sessions, and the multi-step reasoning process involved in generating responses.",I recommend accepting the article as it clearly meets the criterion for Memory and Reasoning Implementation.,1,1
BpryDLtWHWkx,document_ingestion_process,"The article provides a comprehensive overview of the document ingestion and processing for the chatbot, detailing the sources, embedding generation, and storage in a vector database. It effectively outlines the necessary steps taken to prepare the documents for use in the chatbot.","To enhance the article further, consider including details on text preprocessing and chunking strategies, as these are important aspects of document handling that could improve clarity and completeness.",1,1
BpryDLtWHWkx,prompt_engineering_implementation,"The article lacks explicit prompt templates or examples, which are essential for demonstrating clear prompt engineering implementation. While it mentions the integration of context through the use of retrieved documents, it does not provide sufficient detail on the prompt design strategy or system messages, which are critical components of effective prompt engineering.","To improve, the authors should include specific examples of prompts used, document their prompt design strategies, and clarify how context is integrated into the prompts.",1,0
BpryDLtWHWkx,embedding_model_selection,"The article clearly specifies the embedding models used (Google Gemini 2.5 and text-embedding-004) and provides a rationale for their selection in the context of the chatbot's functionality. It also demonstrates an understanding of how these models are applied in generating and retrieving embeddings, which aligns with the criterion for Embedding Model Selection and Configuration.",The article meets the criterion and should be considered for further evaluation or publication.,1,1
BpryDLtWHWkx,text_chunking_strategy,"The article fails to provide essential details regarding the text chunking strategy, such as chunk size and overlap parameters. Without this information, it cannot be determined if the chunking method is effective or appropriate for creating a searchable knowledge base.","To improve the article, the authors should include specific details about their chunking strategy, including the size of the chunks, any overlap used, and the method of chunking implemented.",1,0
BpryDLtWHWkx,model_selection,"The article clearly identifies the specific language model used, which is Google's Gemini 2.5 Flash. It also provides a rationale for its selection, highlighting the model's capabilities in generating accurate and source-backed responses for a U.S. history chatbot. The integration with ChromaDB and LangChain further demonstrates a thoughtful approach to model selection, fulfilling the criterion effectively.",The article should be accepted as it meets the criterion for Model Selection for Response Generation.,1,1
BpryDLtWHWkx,rag_architecture_explanation,"The article provides a detailed explanation of the RAG architecture, including document processing, vector store choice, embedding model, and retrieval mechanism. Each component is clearly articulated, demonstrating a solid understanding of the implementation details necessary for a chatbot specializing in U.S. history.",The article meets the criterion for RAG Architecture Implementation Details and serves as a valuable resource for understanding the technology.,1,1
BpryDLtWHWkx,rag_implementation,"The article successfully demonstrates the implementation of Retrieval-Augmented Generation (RAG) architecture by detailing the integration of document retrieval and language model generation. It effectively describes the use of Google's Gemini 2.5 Flash model for language generation and the retrieval of relevant document chunks from a knowledge base, fulfilling the requirements of the criterion.",Approve the publication as it meets the RAG Implementation criteria.,1,1
BpryDLtWHWkx,project_scope_clarity,"The article clearly defines the scope of the RAG project by specifying the document domain (U.S. history) and the knowledge base (the book 'Outline of U.S. History'). It outlines the basic use cases and target queries effectively, demonstrating how the chatbot will function. Additionally, it describes the capabilities of the RAG assistant and provides a rationale for the choice of the document set, fulfilling all necessary requirements for the criterion.",The article should be considered for approval as it meets the RAG Project Scope Definition criterion comprehensively.,1,1
BpryDLtWHWkx,agentic_patterns_implementation,"The article effectively demonstrates the use of structured reasoning patterns and systematic frameworks in the design of the RAG-based chatbot. It outlines a clear process for generating vector embeddings and utilizing a vector database for information retrieval, which aligns with the criterion of agentic patterns and frameworks usage.",The article should be accepted as it meets the criterion for 'Agentic Patterns and Frameworks Usage' by showcasing a well-implemented RAG system that incorporates advanced reasoning techniques.,1,1
BpryDLtWHWkx,similarity_search_configuration,"The article effectively discusses the similarity search mechanism utilized by the chatbot, detailing the conversion of user queries into embeddings using the `text-embedding-004` model. It also specifies the use of ChromaDB for executing the similarity search, demonstrating a clear understanding of the process and relevant algorithms involved.","The article meets the criterion for similarity search and retrieval configuration. It provides adequate detail regarding the methods and parameters used, making it compliant with the expectations for this criterion.",1,1
wpI38s0JViqj,retrieval_evaluation_metrics,"The article does not contain any sections or paragraphs that address retrieval performance evaluation and metrics. There are no mentions of retrieval accuracy metrics, performance testing, or documentation of evaluation methodology, which are essential for meeting the criterion.","To improve the article, it is recommended to include detailed sections discussing retrieval performance measurement, evaluation approaches, and methodologies.",1,0
wpI38s0JViqj,chunk_overlap_strategy,"The article does not contain any content related to chunk overlap and context preservation. There are no sections that discuss the implementation, parameters, or rationale for chunk overlap, which are essential for meeting the criterion.","To improve the article, it should include detailed discussions on chunk overlap strategies, including how they are implemented and their importance for context preservation.",1,0
wpI38s0JViqj,query_processing_optimization,The article effectively describes the use of vector embeddings for query preprocessing and demonstrates query enhancement techniques by selecting relevant text chunks based on cosine similarity. These aspects indicate a solid understanding of query processing and optimization.,The article meets the criterion and should be considered for approval.,1,1
wpI38s0JViqj,text_chunking_strategy,"The article does not provide any information regarding the text chunking strategy and implementation. There are no details about chunk size, overlap parameters, or any related configurations, which are essential for meeting the criterion.","To improve the article, the authors should include a comprehensive section on their text chunking strategy, detailing the parameters used and the rationale behind their choices.",1,0
wpI38s0JViqj,agentic_patterns_implementation,"The article fails to demonstrate the use of agentic patterns and frameworks as required by the criterion. It lacks structured reasoning patterns, systematic reasoning frameworks, and does not document any thought-action-observation cycles. The content primarily focuses on basic interactions without showcasing advanced reasoning techniques.","To improve, the authors should incorporate discussions on structured reasoning patterns, systematic frameworks, and the implementation of agentic AI patterns to better align with the expectations of the criterion.",1,0
