publication_external_id,criteria,explanation,recommendation,total,score
m7GVzxm05ZEj,vector_store_implementation,"The article clearly identifies FAISS as the vector store used in the RAG system and provides a rationale for its selection, emphasizing its efficiency in vector storage and similarity search. It also details the configuration of the FAISS index for fast retrieval, demonstrating a solid understanding of its purpose and functionality.",The article meets the criterion for Vector Store Selection and Configuration. It is recommended for approval.,1,1
m7GVzxm05ZEj,embedding_model_selection,"The article clearly identifies the embedding model used, which is OpenAI's embedding model, and explains its purpose in converting text into high-dimensional vectors that capture semantic meaning. This demonstrates a solid understanding of the model's capabilities and its relevance to the task at hand.",The article meets the criterion for 'Embedding Model Selection and Configuration' and should be considered compliant.,1,1
m7GVzxm05ZEj,document_ingestion_process,"The article provides a clear and detailed description of the document ingestion and processing workflow, including document selection, text preprocessing, chunking strategy, and embedding generation. These elements are essential for meeting the criterion.",The article is compliant with the criterion for Document Ingestion and Processing and should be considered for approval.,1,1
m7GVzxm05ZEj,memory_and_reasoning,"The article does not provide any details regarding the implementation of memory mechanisms or reasoning capabilities. It lacks information on how conversation history is managed, how context is maintained across interactions, and does not describe any multi-step reasoning processes. Therefore, it does not meet the criterion for Memory and Reasoning Implementation.","To improve the article, the authors should include specific details about memory management strategies, context persistence across user interactions, and any reasoning capabilities that the RAG assistant may utilize.",1,0
m7GVzxm05ZEj,rag_architecture_explanation,"The article provides a comprehensive overview of the RAG architecture implementation details, including document processing, chunking, the choice of vector store (FAISS), the embedding model (OpenAI's), and the retrieval mechanism. Each component is clearly explained, demonstrating a thorough understanding of the RAG pipeline.",The article meets the criterion for RAG Architecture Implementation Details and should be considered for publication.,1,1
m7GVzxm05ZEj,chunk_overlap_strategy,"The article clearly describes the implementation of chunk overlap in document processing, specifying the parameters of 500 characters with a 50-character overlap. It also explains the rationale behind this approach, which is to maintain context continuity across document segments. This demonstrates a solid understanding of the importance of chunk overlap in preserving information integrity.",The article meets the criterion for chunk overlap and context preservation. It should be considered compliant and is recommended for approval.,1,1
m7GVzxm05ZEj,prompt_engineering_implementation,"The article effectively describes the process of using a custom prompt template in conjunction with retrieved document chunks to generate answers from the OpenAI LLM. It demonstrates clear integration of context and structured prompt design, which are essential components of effective prompt engineering.",Consider providing additional examples of the prompt templates used and further details on the strategies for context integration to enhance the clarity and depth of the article.,1,1
m7GVzxm05ZEj,text_chunking_strategy,"The article clearly specifies the chunk size as 500 characters and the overlap as 50 characters, which are essential parameters for text chunking. It also describes the method used for chunking, indicating the use of a recursive character splitter to maintain context continuity. This thorough explanation meets all the necessary requirements for the criterion.","The article is compliant with the criterion for Text Chunking Strategy and Implementation. It provides a clear and detailed explanation of the chunking strategy, including the necessary parameters and method.",1,1
m7GVzxm05ZEj,retrieval_evaluation_metrics,"The article provides a clear and detailed methodology for evaluating the RAG Assistant App, including steps for document preparation, indexing, user interaction, and evaluation of answers. It also discusses the assessment of answer quality based on relevance and accuracy, which aligns with the criterion for Retrieval Performance Evaluation and Metrics.",The article is compliant with the criterion and should be considered for publication.,1,1
m7GVzxm05ZEj,guardrails_implementation,"The article does not provide any information regarding guardrails and safety measures. There are no mentions of safety protocols, content filtering, or input validation mechanisms that are essential for ensuring the safe use of the RAG assistant system. Without these critical components, the article fails to meet the criterion for Guardrails and Safety Measures.","It is recommended that the authors revise the article to include comprehensive details on the safety measures implemented in the RAG assistant app. This should cover aspects such as content moderation, user input validation, and any other relevant safety protocols.",1,0
m7GVzxm05ZEj,query_processing_optimization,"The article effectively outlines the process of query processing and optimization through various techniques such as query preprocessing, embedding generation, and structured query handling. These elements demonstrate a comprehensive understanding of the necessary strategies to enhance retrieval accuracy and relevance.",The article meets the criterion for 'Query Processing and Optimization' and should be considered for approval.,1,1
m7GVzxm05ZEj,model_selection,The article explicitly names OpenAI as the supplier of the LLM and describes its integration into the RAG pipeline for generating responses. It provides a basic rationale for the model choice and demonstrates an understanding of the model's capabilities in the context of the use case.,The article meets the criterion for model selection and is satisfactory in its explanation of the LLM's role in the response generation process.,1,1
m7GVzxm05ZEj,project_scope_clarity,"The article provides a clear and comprehensive overview of the RAG assistant's implementation, including its document domain, basic use cases, and capabilities. It effectively outlines the specific focus on technical documentation for LangChain and LangGraph, and describes how users can interact with the assistant through targeted queries. Additionally, the methodology section explains the choice of document set, ensuring that all aspects of the criterion are addressed.",The article meets the criterion for RAG Project Scope Definition and should be considered compliant.,1,1
m7GVzxm05ZEj,similarity_search_configuration,"The article effectively discusses similarity search mechanisms, specifically mentioning the use of FAISS for efficient vector storage and retrieval. It outlines the process of embedding queries and retrieving relevant document chunks, demonstrating a clear understanding of similarity metrics and search parameters.","To enhance clarity, consider providing more detailed examples of how FAISS is implemented in practice and the specific parameters used during the search process.",1,1
m7GVzxm05ZEj,rag_implementation,The article effectively demonstrates the principles of Retrieval-Augmented Generation (RAG) by integrating document retrieval with LLM generation. It outlines the use of vector storage for efficient retrieval and clearly describes how the system retrieves relevant context to enhance the LLM's responses.,I recommend accepting the article as it meets the RAG Implementation criterion comprehensively.,1,1
m7GVzxm05ZEj,agentic_patterns_implementation,"The article does not demonstrate an understanding or implementation of advanced reasoning frameworks or systematic reasoning patterns as required by the criterion. The evaluations indicate that while the article discusses the RAG assistant's functionality and methodology, it lacks explicit references to structured reasoning or agentic patterns.","To improve, the authors should incorporate discussions on structured reasoning patterns and systematic frameworks in their work.",1,0
EIBBy4jo6Kk1,chunk_overlap_strategy,"The article successfully discusses the implementation of chunk overlap in data processing for a Wikipedia-based RAG system, specifying an overlap of 200 tokens. This indicates a clear understanding of the importance of context preservation in data chunking.","To enhance the article, consider elaborating on the rationale behind the chosen overlap size and its benefits for context continuity.",1,1
EIBBy4jo6Kk1,query_processing_optimization,"The article fails to address key components of query processing and optimization, such as query preprocessing techniques, enhancement strategies, and optimization techniques. While it touches on context retrieval and fact verification, it lacks a comprehensive discussion on these essential elements, which are necessary to meet the criterion.","To improve the article, the authors should include detailed sections on query preprocessing, enhancement techniques, and optimization strategies to align with the evaluation criteria.",1,0
EIBBy4jo6Kk1,guardrails_implementation,"The article demonstrates effective guardrails and safety measures by implementing input validation, content moderation, and output filtering. It successfully identifies out-of-scope queries and provides appropriate warnings, ensuring that responses are factually accurate and safe.",Continue to enhance the system's safety measures by regularly updating the moderation protocols and ensuring comprehensive testing against a wide range of query types. This will help maintain high standards of safety and reliability in the system.,1,1
EIBBy4jo6Kk1,retrieval_evaluation_metrics,"The article provides a comprehensive evaluation of the retrieval performance of the RAG system, detailing the methodology, types of queries tested, and the results of these tests. It effectively measures retrieval accuracy and effectiveness, demonstrating a clear understanding of the evaluation process.",The article meets the criterion for Retrieval Performance Evaluation and Metrics. It should be considered for acceptance.,1,1
EIBBy4jo6Kk1,memory_and_reasoning,"The article provides clear evidence of implementing memory and reasoning capabilities through the `ConversationMemory` class and its methods, which manage conversation history effectively. Additionally, the integration of conversation history in query processing demonstrates a commitment to maintaining context across interactions.",The article meets the criterion for Memory and Reasoning Implementation and should be considered compliant.,1,1
EIBBy4jo6Kk1,rag_architecture_explanation,"The article provides detailed information about the RAG architecture, including document processing, chunking, the vector store used, and the embedding model. It clearly outlines the retrieval mechanism, fulfilling all aspects of the criterion.",Proceed with the publication as it meets the specified criterion.,1,1
EIBBy4jo6Kk1,document_ingestion_process,"The article provides clear and comprehensive details on all aspects of document ingestion and processing, including document selection, preprocessing steps, chunking strategy, and embedding generation. Each of these components is adequately addressed, demonstrating compliance with the criterion.","It is recommended to consider this article compliant with the specified criterion, as it meets all necessary requirements.",1,1
EIBBy4jo6Kk1,similarity_search_configuration,"The article demonstrates a clear understanding of similarity search and retrieval configuration through the mention of specific similarity metrics, algorithms, and search parameters. The inclusion of the `_compute_similarity` method and the `FactChecker` class indicates a robust approach to validating information based on similarity, which is essential for effective document retrieval.",Continue to elaborate on the implementation details of the similarity search mechanisms in future sections to enhance clarity and provide deeper insights into the system's functionality.,1,1
EIBBy4jo6Kk1,text_chunking_strategy,"The article clearly specifies the chunk size of 1000 tokens and an overlap of 200 tokens, which directly addresses the requirement for chunking implementation. It also provides context about the data source and the embedding model, enhancing the understanding of the chunking configuration.",The article meets the criterion for 'Text Chunking Strategy and Implementation' and should be considered compliant.,1,1
EIBBy4jo6Kk1,vector_store_implementation,"The article explicitly names ChromaDB as the vector store used in the RAG system, which satisfies the requirement of identifying the vector storage solution. Additionally, it provides relevant configuration details such as chunk size and overlap, indicating an understanding of how the vector store is utilized within the system. While the rationale for choosing ChromaDB could be more explicit, the existing information is sufficient to meet the criterion.","To improve the article, consider adding a more detailed explanation of why ChromaDB was selected as the vector store, including its advantages or specific features that align with the system's needs.",1,1
EIBBy4jo6Kk1,model_selection,"The article explicitly mentions the use of the 'gpt-4-turbo-preview' model, which satisfies the requirement of naming the specific language model used for response generation. Additionally, while it does not provide an extensive rationale for the model choice, the context implies an understanding of its capabilities, which is sufficient for this criterion.","To enhance the article, consider adding a more detailed explanation of why 'gpt-4-turbo-preview' was chosen over other models, including its strengths and suitability for the intended application.",1,1
EIBBy4jo6Kk1,prompt_engineering_implementation,"The article lacks clear examples of prompt templates, does not demonstrate how context is integrated into the prompts, and fails to provide documentation on the prompt design approach. These deficiencies indicate that the article does not meet the criterion for Clear Prompt Engineering Implementation.","To improve, the authors should include specific examples of prompts, illustrate the integration of retrieved context, and document their prompt design strategies.",1,0
EIBBy4jo6Kk1,rag_implementation,"The article effectively demonstrates the key components of a Retrieval-Augmented Generation (RAG) system, including document retrieval, the use of a vector store, and the integration of retrieved documents into the generation process. These elements are crucial for meeting the RAG Implementation criterion.",The article should be accepted as it meets the necessary requirements for RAG Implementation.,1,1
EIBBy4jo6Kk1,embedding_model_selection,"The article explicitly mentions the embedding model 'text-embedding-3-large', which satisfies the requirement for naming a specific embedding model. Additionally, the context of using Wikipedia articles suggests a focus on semantic understanding, which aligns with the intended use of such models.","To enhance the article, it would be beneficial to include a more detailed rationale for the choice of the embedding model and to discuss its capabilities in relation to the tasks it is intended to perform.",1,1
EIBBy4jo6Kk1,agentic_patterns_implementation,The article demonstrates a clear understanding of agentic patterns and frameworks through its implementation of a `FactChecker` class and systematic reasoning in the `validate_answer` method. These elements indicate structured reasoning patterns and a thoughtful approach to fact verification and conversation management.,"To further enhance the article, consider including more explicit examples of thought-action-observation cycles and additional discussions on reasoning frameworks.",1,1
EIBBy4jo6Kk1,project_scope_clarity,"The article clearly defines the RAG assistant's implementation, including its knowledge base, use cases, and capabilities. It specifies that Wikipedia articles are used as the knowledge source and describes how the system handles various types of queries, which aligns with the requirements for RAG Project Scope Definition.",The article meets the criterion effectively. It may enhance its clarity by providing more examples of practical applications or a detailed implementation process.,1,1
RlZIfkqK8e4u,embedding_model_selection,The article mentions the use of an OpenAI embeddings model but fails to provide a rationale for its selection or discuss the model's capabilities. This lack of detail indicates that the article does not fully meet the criterion for Embedding Model Selection and Configuration.,"To improve, the article should include a justification for the choice of the OpenAI embeddings model and elaborate on its features and advantages.",1,0
RlZIfkqK8e4u,retrieval_evaluation_metrics,"The article does not provide any information regarding retrieval performance evaluation or metrics. There are no sections discussing measurement approaches, evaluation methodologies, or any relevant metrics that would demonstrate compliance with the criterion. Additionally, the absence of a code repository and dataset URLs further indicates a lack of necessary information to assess retrieval performance.","To improve the article's compliance with this criterion, it is essential to include detailed sections on retrieval performance evaluation, including methodologies, metrics, and possibly examples of testing results.",1,0
RlZIfkqK8e4u,guardrails_implementation,"The article does not address the criterion of Guardrails and Safety Measures. There are no sections or paragraphs that discuss safety guardrails, content filtering mechanisms, or any measures taken to ensure safe interactions with the RAG assistant.","To improve the article, it should include detailed information on the safety measures implemented in the RAG assistant system, such as input validation and content filtering mechanisms.",1,0
RlZIfkqK8e4u,prompt_engineering_implementation,"The article effectively demonstrates clear prompt engineering implementation by detailing the process of forming prompts, integrating context, and providing instructions to the language model. It also documents the prompt design and context integration strategies clearly.",The article should be considered as meeting the criterion for Clear Prompt Engineering Implementation.,1,1
RlZIfkqK8e4u,similarity_search_configuration,"The article clearly outlines the use of a FAISS vector store for similarity search, describes the embedding process using OpenAI models, and explains how user queries are processed to retrieve relevant document chunks. This demonstrates a solid understanding of similarity search mechanisms and their implementation.",The article meets the criterion for similarity search and retrieval configuration. It should be approved.,1,1
RlZIfkqK8e4u,document_ingestion_process,"The article provides a comprehensive overview of the document ingestion and processing steps, including document selection, text preprocessing, embedding generation, and storage in a vector store. Each step is clearly articulated, demonstrating a thorough understanding of the process.",The article meets the criterion for Document Ingestion and Processing. It should be considered for approval.,1,1
RlZIfkqK8e4u,chunk_overlap_strategy,"The article does not provide any content related to chunk overlap strategies, their implementation, or parameters. All necessary indicators for meeting the criterion are absent, leading to a failure in compliance.","To improve the article, it is essential to include detailed discussions on chunk overlap strategies, their rationale, and how they are implemented. This will help in meeting the criterion effectively.",1,0
RlZIfkqK8e4u,memory_and_reasoning,"The article does not contain any information regarding the implementation of memory mechanisms or reasoning capabilities. There are no discussions on conversation history management, context persistence, or multi-step reasoning approaches, which are essential for meeting the criterion.",It is recommended that the authors include detailed descriptions of memory mechanisms and reasoning capabilities in future revisions to enhance compliance with the criterion.,1,0
RlZIfkqK8e4u,text_chunking_strategy,"The article does not provide any paragraphs or information regarding the text chunking strategy and implementation. Without this critical information, it is impossible to assess whether the article meets the criterion.","To improve the article, it is essential to include detailed sections on the text chunking strategy, including the implementation methods, chunk sizes, and any relevant parameters.",1,0
RlZIfkqK8e4u,vector_store_implementation,"The article clearly mentions the use of FAISS as the vector store, provides a rationale for its selection, and includes detailed configuration steps for creating and saving the vector store. It also demonstrates an understanding of the vector store's purpose in facilitating natural language queries.",The article meets the criterion for Vector Store Selection and Configuration. No changes are necessary.,1,1
RlZIfkqK8e4u,rag_implementation,"The article effectively describes the implementation of the Retrieval-Augmented Generation (RAG) architecture, detailing both the retrieval and generation components. It mentions the use of vector storage (FAISS) and the generation of embeddings, as well as the integration of retrieved documents with the language model prompts, fulfilling all necessary aspects of the criterion.",The article should be considered as successfully meeting the RAG Implementation criterion.,1,1
RlZIfkqK8e4u,project_scope_clarity,"The article clearly defines the RAG assistant implementation, its intended use case, and the specific knowledge base utilized. It provides detailed information about the document domain, basic functionality, and capabilities of the assistant, which aligns with the requirements of the criterion.",The article meets the criterion for RAG Project Scope Definition and should be considered compliant.,1,1
RlZIfkqK8e4u,query_processing_optimization,The article effectively describes a method for enhancing retrieval accuracy through query preprocessing by prepending the ID and Title to the publication description. This aligns with the criterion of demonstrating query enhancement techniques and shows an understanding of query transformation.,The article meets the criterion for Query Processing and Optimization. It is recommended for acceptance as it provides clear and relevant information on improving query accuracy.,1,1
RlZIfkqK8e4u,rag_architecture_explanation,"The article provides a comprehensive overview of the RAG architecture implementation, detailing the document processing, vector store choice, embedding model, and retrieval mechanism. Each aspect is clearly explained, demonstrating that the article meets the criterion effectively.",The article should be considered compliant with the specified criterion and is recommended for approval.,1,1
RlZIfkqK8e4u,agentic_patterns_implementation,"The article demonstrates structured reasoning patterns and systematic frameworks through its detailed description of the RAG architecture and its operational phases. The use of tools like LangChain and FAISS indicates a systematic approach to data management and retrieval, which aligns with the criterion of agentic patterns and frameworks usage.","To further enhance the clarity of the article, it is recommended to explicitly highlight the advanced reasoning capabilities and structured patterns used in the RAG system. This will help readers better understand the sophistication of the reasoning frameworks implemented.",1,1
RlZIfkqK8e4u,model_selection,The article mentions the use of an OpenAI Large Language Model but fails to provide a rationale for its selection or discuss its capabilities in the context of the RAG pipeline. This lack of detail means it does not fully meet the criterion for Model Selection for Response Generation.,"To improve, the authors should include a clear rationale for choosing the OpenAI LLM and elaborate on its capabilities relevant to the use case.",1,0
4fBZ6PYkO2mZ,chunk_overlap_strategy,"The article does not provide sufficient information regarding chunk overlap strategies or parameters used in the chunking process. It fails to explain how context continuity is maintained across document segments, which is crucial for meeting the criterion of 'Chunk Overlap and Context Preservation.'","To improve the article, the authors should include detailed information about their chunking strategy, specifically addressing how they implement chunk overlap and the rationale behind it to ensure context preservation.",1,0
4fBZ6PYkO2mZ,vector_store_implementation,"The article clearly mentions the use of FAISS as the vector store for storing text embeddings. It also describes the process of generating these embeddings and how they are utilized within an EnsembleRetriever, demonstrating a solid understanding of both the selection and configuration of the vector store.","To further enhance the article, consider providing a more detailed rationale for the choice of FAISS over other vector stores, as well as any specific configuration settings that were used.",1,1
