publication_external_id,criteria,explanation,recommendation,total,score
XTZxtVu1fotd,document_ingestion_process,"The article fails to address key aspects of document ingestion and processing, including document selection, text preprocessing, chunking strategies, and embedding generation. These omissions indicate that the article does not meet the necessary criterion for this topic.","To improve the article, the authors should include detailed descriptions of how documents are selected and sourced, outline the preprocessing steps required before ingestion, explain the chunking strategy for processing documents, and describe the method for generating embeddings.",1,0
XTZxtVu1fotd,embedding_model_selection,"The article mentions two specific embedding models, `text-embedding-005` and `gemini-2.0-flash`, but fails to provide any rationale for their selection or discuss their capabilities. This lack of explanation and context means the article does not meet the criterion for embedding model selection and configuration.","To improve the article, the authors should include a discussion on why these specific models were chosen, highlighting their strengths and how they contribute to the overall effectiveness of the document and query representation.",1,0
XTZxtVu1fotd,rag_implementation,"The article does not demonstrate any elements of Retrieval-Augmented Generation (RAG) architecture. It lacks details on document retrieval, LLM generation, vector storage, and the integration of external knowledge, which are essential components of RAG.","To improve the article, the authors should include explicit descriptions of how the Slack bot utilizes document retrieval and integrates with LLM generation, as well as any mechanisms for vector storage and similarity search.",1,0
XTZxtVu1fotd,model_selection,"The article fails to provide any rationale for the selection of the specific language models mentioned, nor does it discuss their capabilities in relation to the intended use case. Without this critical information, the article does not meet the criterion for Model Selection for Response Generation.","To improve the article, the authors should include a detailed explanation of why the specific LLMs were chosen, their relevant capabilities, and how they contribute to the response generation process in the RAG pipeline.",1,0
XTZxtVu1fotd,rag_architecture_explanation,"The article fails to provide essential details regarding the RAG architecture implementation. Key components such as the retrieval mechanism, vector store choice, and LLM integration are not addressed, which are critical for understanding the architecture. Additionally, there is no discussion on document processing, which further detracts from meeting the criterion.","To improve the article, it should include comprehensive explanations of the RAG pipeline architecture, detailing how documents are retrieved, the choice of vector store, the integration of the language model, and the processing of documents for response generation.",1,0
XTZxtVu1fotd,prompt_engineering_implementation,"The article provides a clear example of a prompt template and utilizes a role definition, which are both positive indicators of effective prompt engineering. While it lacks explicit details on how the retrieved context is integrated, the presence of a structured prompt and role definition suggests that it meets the basic requirements of the criterion.","To further enhance the article, it is recommended to include more explicit documentation on how the retrieved context from the URL is incorporated into the prompt responses. This would provide a clearer understanding of the integration process.",1,1
XTZxtVu1fotd,project_scope_clarity,"The article provides some relevant information regarding the RAG Project Scope Definition but lacks critical details necessary for a complete understanding. It mentions a specific dataset and a target query, which are positive aspects. However, it fails to define the knowledge base used, does not elaborate on the capabilities of the RAG assistant, and does not explain the choice of the document set. These omissions prevent the article from fully meeting the criterion.","To improve the article, it is essential to clearly define the knowledge base for the RAG assistant, elaborate on its capabilities, and provide reasoning for the selection of the document set. Addressing these points will enhance the article's alignment with the criterion.",1,0
1tzOpsOtVNkC,memory_and_reasoning,"The article explicitly mentions the implementation of conversational memory and the display of prior interactions, which are essential components of memory mechanisms in conversational agents. This indicates that the system is designed to manage conversation history effectively, fulfilling the requirements of the criterion.",The article should be considered compliant with the criterion for Memory and Reasoning Implementation.,1,1
1tzOpsOtVNkC,text_chunking_strategy,"The evaluation indicates that there are no paragraphs provided for assessment regarding the Text Chunking Strategy and Implementation. Without any content to review, it is impossible to determine if the article meets the necessary criteria for chunking implementation, chunk size, or overlap parameters.","To improve the article's compliance with the criterion, the authors should include detailed descriptions of their text chunking strategy, including specific parameters and methods used.",1,0
1tzOpsOtVNkC,guardrails_implementation,"The article does not address any safety guardrails or content filtering mechanisms, which are essential components of the criterion. There are no sections or paragraphs that discuss safety considerations, leading to a clear lack of compliance with the requirement.","To improve the article, it is crucial to include a dedicated section on safety measures, detailing how the system will handle inappropriate content and ensure user safety.",1,0
1tzOpsOtVNkC,query_processing_optimization,"The article discusses the RAG pipeline and includes details about query embedding and matching against stored vectors, which indicates that it addresses query preprocessing effectively.","To enhance the article further, consider adding more information on query enhancement techniques and optimization strategies.",1,1
1tzOpsOtVNkC,embedding_model_selection,The article mentions the embedding model used (HuggingFace sentence-transformers) but fails to provide a rationale for its selection or discuss its capabilities. This lack of detail indicates that the article does not fully meet the criterion for Embedding Model Selection and Configuration.,"To improve, the article should include a justification for the choice of the embedding model, as well as an analysis of its strengths and weaknesses.",1,0
1tzOpsOtVNkC,chunk_overlap_strategy,"The article does not address the criterion of 'Chunk Overlap and Context Preservation' at all. There are no sections or paragraphs that discuss chunk overlap strategies, parameters, rationale, or configuration documentation. As a result, it fails to meet the necessary requirements for this criterion.","To improve the article, the authors should include detailed discussions on chunk overlap strategies, specify overlap parameters, explain the rationale behind the chosen overlap, and document the configuration used. This will help fulfill the criterion in future revisions.",1,0
1tzOpsOtVNkC,prompt_engineering_implementation,The article does not provide clear examples of prompt engineering techniques or document the integration of context into prompts. It lacks specific details that are necessary to demonstrate a thorough understanding of prompt design within the RAG framework.,"To improve, the authors should include explicit examples of prompt templates and a detailed explanation of how context is incorporated into the prompts used in their RAG implementation.",1,0
1tzOpsOtVNkC,project_scope_clarity,"The article provides a comprehensive overview of the RAG assistant's implementation, including its intended use case, document domain, basic functionality, and knowledge base. It clearly outlines the capabilities of the assistant and the specific dataset used, which aligns with the requirements of the criterion.",The article meets the criterion for RAG Project Scope Definition and is suitable for further dissemination.,1,1
1tzOpsOtVNkC,model_selection,"The article clearly identifies the Groq LLaMA model as the language model used for response generation, providing a rationale for its selection based on performance and response speed. This demonstrates a clear understanding of model capabilities relevant to the FAQ assistant use case.",The article meets the criterion for Model Selection for Response Generation and is suitable for publication.,1,1
1tzOpsOtVNkC,retrieval_evaluation_metrics,"The article provides a structured evaluation setup and mentions retrieval accuracy metrics, indicating that it meets the criterion for Retrieval Performance Evaluation and Metrics.","To enhance the article, consider including more detailed documentation of the evaluation methodology and additional performance metrics.",1,1
1tzOpsOtVNkC,vector_store_implementation,"The article successfully identifies the Chroma vector database as the vector store used for storing text embeddings. It provides a clear rationale for its choice by stating that it enables fast semantic retrieval, which aligns with the purpose of a vector store in a retrieval-augmented generation (RAG) system. Additionally, the article demonstrates an understanding of the vector store's role, fulfilling the requirements of the criterion.",The article meets the criterion for Vector Store Selection and Configuration. It is recommended to maintain this level of clarity and rationale in future sections.,1,1
1tzOpsOtVNkC,rag_implementation,"The article successfully implements the Retrieval-Augmented Generation (RAG) architecture by integrating document retrieval with language model generation. It utilizes the Groq LLaMA model for generating answers based on retrieved context, employs HuggingFace sentence-transformers for text embeddings, and stores these embeddings in a Chroma vector database. The retrieval process is clearly outlined, demonstrating effective context retrieval from the knowledge base, and the integration of retrieved documents with LLM prompts is evident.",I recommend that the article be accepted as it meets the RAG Implementation criterion comprehensively.,1,1
1tzOpsOtVNkC,document_ingestion_process,"The article provides relevant information regarding document ingestion and processing, specifically mentioning the sources of the dataset and the method of embedding generation. These details align with the positive indicators of the criterion.","To further enhance the article, it is recommended to include information on text preprocessing steps and chunking strategies, which would provide a more comprehensive understanding of the ingestion process.",1,1
1tzOpsOtVNkC,rag_architecture_explanation,"The article provides a comprehensive overview of the RAG architecture, including the choice of vector store (Chroma), the embedding model (HuggingFace sentence-transformers), and a detailed explanation of the retrieval mechanism. These elements are crucial for understanding the implementation of the RAG pipeline.","To further enhance the article, it would be beneficial to include explicit details on document processing and chunking, as this would provide a more complete picture of the RAG implementation.",1,1
1tzOpsOtVNkC,agentic_patterns_implementation,"The article primarily describes the operational aspects of the RAG pipeline without addressing advanced agentic patterns or structured reasoning frameworks. It lacks mentions of structured reasoning patterns, systematic reasoning frameworks, thought-action-observation cycles, and documentation of reasoning pattern implementation, which are essential for meeting the criterion.","To improve the article, the authors should incorporate discussions on structured reasoning patterns, systematic frameworks, and examples of thought-action-observation cycles. This would enhance the depth and complexity of the content, aligning it more closely with the criterion.",1,0
1tzOpsOtVNkC,similarity_search_configuration,"The article effectively discusses the use of similarity search mechanisms, including the application of HuggingFace sentence-transformers for generating embeddings and the use of a Chroma vector database for retrieval. It demonstrates a clear understanding of the algorithms and methods involved in the retrieval process, as well as the basic search parameters necessary for effective similarity search.",The article meets the criterion for similarity search and retrieval configuration. It should be considered compliant.,1,1
1YrOrfkDQ3bN,memory_and_reasoning,"The article does not provide any information or sections that discuss the implementation of memory mechanisms or reasoning capabilities in the RAG assistant. Key aspects such as conversation history management, context persistence, or multi-step reasoning approaches are absent, which are essential for meeting the criterion.","To improve the article's compliance with the criterion, it is recommended to include detailed discussions on memory management and reasoning strategies relevant to the RAG system.",1,0
1YrOrfkDQ3bN,retrieval_evaluation_metrics,"The article does not provide any information related to retrieval performance evaluation and metrics. There are no sections discussing retrieval accuracy, performance testing, or evaluation methodologies, which are essential for meeting the criterion.","To improve the article, the authors should include detailed discussions on retrieval performance measurement, evaluation approaches, and methodologies.",1,0
1YrOrfkDQ3bN,prompt_engineering_implementation,"The article effectively demonstrates clear prompt engineering implementation by providing a well-defined prompt template and integrating retrieved context. The documentation of prompt design is also clear, fulfilling the requirements of the criterion.",Continue to refine the prompt engineering techniques and consider including more examples to further enhance clarity.,1,1
1YrOrfkDQ3bN,project_scope_clarity,"The article provides a clear definition of the RAG assistant implementation, specifies the knowledge base used (E-MOTIVE Trial Protocol), and outlines the intended use case related to postpartum hemorrhage (PPH). It also discusses the integration of relevant components, demonstrating a comprehensive understanding of the RAG system's capabilities.",The article meets the criterion for RAG Project Scope Definition and should be considered compliant.,1,1
1YrOrfkDQ3bN,guardrails_implementation,"The article does not address any aspects of guardrails and safety measures, which are critical for ensuring responsible use of technology. There are no mentions of safety guardrails, content filtering mechanisms, or any basic safety considerations.","To improve the article, it is essential to include discussions on safety measures, input validation, and content moderation approaches. This will enhance the publication's compliance with the criterion for Guardrails and Safety Measures.",1,0
1YrOrfkDQ3bN,similarity_search_configuration,"The article demonstrates a clear understanding of similarity search mechanisms through its discussion of semantic similarity and the use of a vector database. Additionally, the inclusion of a code snippet that defines a search function with relevant parameters indicates practical implementation of the concepts discussed.","The article meets the criterion for similarity search and retrieval configuration. It effectively combines theoretical insights with practical application, making it a valuable resource for understanding and implementing similarity search.",1,1
1YrOrfkDQ3bN,rag_implementation,"The article successfully demonstrates the implementation of a Retrieval-Augmented Generation (RAG) system by detailing the use of LangChain for orchestration, Hugging Face models for generation, and ChromaDB for vector storage. It clearly outlines the process of retrieving context from a knowledge base and integrating that context into the prompts for the language model, fulfilling all necessary components of the RAG architecture.",I recommend accepting the article as it meets the criterion for demonstrating a RAG system effectively.,1,1
1YrOrfkDQ3bN,vector_store_implementation,"The article provides a clear mention of ChromaDB as the vector store used in the RAG system, along with a rationale for its selection based on its ability to store text chunks and their embeddings for efficient retrieval. Additionally, it includes specific configuration details about how embeddings are generated and stored, demonstrating a comprehensive understanding of the vector store's role in the system.",I recommend accepting the article as it meets the criterion for Vector Store Selection and Configuration.,1,1
1YrOrfkDQ3bN,model_selection,"The article explicitly mentions the use of the 'google/flan-t5-base' model, which is a clear indication of model selection for response generation. Additionally, it implies an understanding of the model's capabilities in the context of a RAG pipeline, fulfilling the requirement for rationale behind the model choice.",The article meets the criterion for model selection. It is recommended to maintain this clarity in future discussions of model choices.,1,1
1YrOrfkDQ3bN,document_ingestion_process,"The article provides a thorough overview of the document ingestion and processing steps, including document selection, text preprocessing, chunking strategy, and embedding generation. Each aspect is clearly articulated and demonstrates a solid understanding of the requirements for building a RAG system with open-source tools.",The article is recommended for approval as it meets the Document Ingestion and Processing criterion.,1,1
1YrOrfkDQ3bN,chunk_overlap_strategy,"The article effectively discusses chunk overlap strategies, providing clear implementation details and rationale for maintaining context continuity. It specifies overlap parameters and includes a code snippet for practical application, fulfilling the criterion requirements.",Continue to provide detailed explanations and practical examples in future sections to enhance clarity and understanding.,1,1
1YrOrfkDQ3bN,rag_architecture_explanation,"The article provides a detailed overview of the RAG architecture, including the retrieval mechanism, document processing, and the embedding model used. It effectively covers all necessary components for understanding the implementation of a RAG system.",I recommend accepting the article as it meets the criterion for RAG Architecture Implementation Details.,1,1
1YrOrfkDQ3bN,embedding_model_selection,"The article explicitly mentions the embedding model used, which is `sentence-transformers/all-MiniLM-L6-v2`, and provides a rationale for its choice by discussing its capabilities in generating vector embeddings that capture semantic meaning. Additionally, it shows awareness of hardware compatibility for running the model, which further supports its compliance with the criterion.",The article should be considered compliant with the Embedding Model Selection and Configuration criterion.,1,1
1YrOrfkDQ3bN,text_chunking_strategy,"The article clearly specifies the chunk size and overlap parameters, which are essential for understanding the text chunking strategy. It also provides a code snippet that demonstrates the implementation of the chunking process using the `CharacterTextSplitter`, fulfilling the requirement for a basic chunking implementation. Additionally, it mentions the configuration of chunking, which aligns with the expectations outlined in the criterion.",The article effectively meets the criterion for 'Text Chunking Strategy and Implementation.' It is recommended for publication as it provides valuable insights into the chunking process.,1,1
1YrOrfkDQ3bN,query_processing_optimization,"The article fails to address key aspects of query processing and optimization, such as query preprocessing, enhancement techniques, validation, and optimization strategies. These omissions indicate that the article does not meet the necessary criterion for this topic.","To improve the article, it is recommended to include detailed discussions on query preprocessing methods, enhancement strategies, and optimization techniques to adequately cover the criterion.",1,0
1YrOrfkDQ3bN,agentic_patterns_implementation,"The article primarily focuses on the technical implementation of a Retrieval-Augmented Generation (RAG) system without addressing structured reasoning patterns, systematic reasoning frameworks, or thought-action-observation cycles. These elements are essential for demonstrating agentic behavior and understanding within the context of the criterion.","To improve the article, the authors should incorporate discussions on structured reasoning patterns, systematic frameworks, and the implementation of thought-action-observation cycles.",1,0
967PpYl1ONyD,text_chunking_strategy,"The article clearly specifies the chunk size and overlap parameters for the text chunking strategy, stating 'chunk_size = 300' and 'overlap = 50'. This aligns with the requirement to mention chunking implementation with specific parameters.",The article meets the criterion for Text Chunking Strategy and Implementation. It effectively outlines the necessary parameters and provides a clear implementation of the chunking strategy.,1,1
967PpYl1ONyD,memory_and_reasoning,"The article does not address any memory mechanisms or reasoning capabilities in the RAG assistant, which are essential for fulfilling the criterion. It focuses solely on processing and retrieval techniques without discussing how to manage conversation history or implement multi-step reasoning.","To improve the article, it should include a detailed discussion on memory management strategies and reasoning capabilities to meet the criterion.",1,0
967PpYl1ONyD,retrieval_evaluation_metrics,"The article provides a clear testing methodology and specific performance metrics related to retrieval performance evaluation. It outlines manual test cases and suggests the potential for automated testing, which indicates a structured approach to evaluation. Additionally, it includes quantitative metrics such as retrieval speed and accuracy of responses, demonstrating effective measurement of performance.",The article meets the criterion for Retrieval Performance Evaluation and Metrics. It is recommended for acceptance.,1,1
967PpYl1ONyD,similarity_search_configuration,"The article demonstrates a clear understanding of similarity search mechanisms, including the use of specific algorithms and metrics relevant to document retrieval. It effectively discusses the implementation of `FAISS` and `IndexFlatIP`, which are crucial for similarity search, and provides adequate details on the configuration of search parameters.",The article meets the criterion for Similarity Search and Retrieval Configuration and is recommended for acceptance.,1,1
967PpYl1ONyD,document_ingestion_process,"The article successfully outlines the process of document ingestion and processing, covering all necessary aspects such as document selection, text preprocessing, chunking strategy, and embedding generation.",The article is recommended for approval as it meets all the criteria for Document Ingestion and Processing.,1,1
967PpYl1ONyD,chunk_overlap_strategy,"The article clearly specifies the chunk size and overlap parameters, which are essential for effective chunking and context preservation. The mention of a 300 chunk size and a 50 overlap indicates a thoughtful approach to maintaining context across chunks.",The article meets the criterion for chunk overlap and context preservation. It is recommended to continue documenting such configurations clearly in future articles.,1,1
967PpYl1ONyD,rag_architecture_explanation,"The article provides a detailed overview of the RAG architecture, including document processing, chunking, vector store usage, embedding model, and retrieval mechanism. Each component is clearly explained, demonstrating a thorough understanding of the implementation details required for RAG.",The article meets the criterion effectively and should be considered for publication.,1,1
967PpYl1ONyD,model_selection,"The article clearly identifies the specific LLM used, which is the Groq LLM with the model mixtral-8x7b-32768. It also provides a rationale for its selection, stating that it is used for fast and accurate response generation. This demonstrates an understanding of the model's capabilities and its relevance to the application.","The article meets the criterion for Model Selection for Response Generation. It effectively communicates the choice of model and its intended use, making it compliant with the evaluation standards.",1,1
967PpYl1ONyD,embedding_model_selection,"The article explicitly mentions the use of the `sentence-transformers` model for generating document embeddings, which directly addresses the criterion of embedding model selection and configuration. While it could benefit from a more detailed rationale for the choice of this model, the current mention indicates a sufficient level of understanding regarding its capabilities and application.","To enhance clarity and depth, the article should include a more explicit rationale for choosing `sentence-transformers` over other potential models.",1,1
