publication_external_id,criteria,explanation,recommendation,total,score
1EyrHhLul5KU,similarity_search_configuration,"The article effectively discusses the use of the `OllamaEmbeddings` class for generating vector embeddings and the implementation of the FAISS database for similarity search. It clearly outlines the retrieval process, demonstrating a solid understanding of the mechanisms involved in similarity search and retrieval configuration.",The article meets the criterion for 'Similarity Search and Retrieval Configuration' and should be considered for approval.,1,1
1EyrHhLul5KU,chunk_overlap_strategy,"The article clearly discusses the implementation of chunk overlap strategies, specifying the use of overlapping chunks of 1,000 characters. It also explains the rationale behind this approach, emphasizing the importance of maintaining context and semantic cohesion, which aligns with the criterion requirements.",The article meets the criterion for 'Chunk Overlap and Context Preservation' and should be considered compliant.,1,1
a5JYVWRZcIL3,memory_and_reasoning,"The article does not address any implementation of memory mechanisms or multi-step reasoning approaches, which are critical components of the criterion. It focuses solely on persistent vector storage and prompt engineering without demonstrating the required memory or reasoning capabilities.","To improve the article, the authors should include discussions on memory management strategies and reasoning processes in future revisions.",1,0
a5JYVWRZcIL3,guardrails_implementation,"The article does not address any aspects of Guardrails and Safety Measures. There are no sections discussing safety protocols, content filtering, or input validation mechanisms, which are essential for ensuring the responsible use of the RAG architecture in literary analysis.","To improve the article, it is crucial to include a dedicated section on safety measures, outlining how the system will handle potentially harmful content and ensure user safety.",1,0
a5JYVWRZcIL3,text_chunking_strategy,"The article does not provide any information regarding the text chunking strategy and implementation for the RAG system. There are no details about chunk size, overlap parameters, or the chunking method used, which are essential for meeting the criterion.","To improve compliance with the criterion, the authors should include a dedicated section that outlines their text chunking strategy, specifying parameters such as chunk size and overlap, along with a clear description of the chunking method employed.",1,0
a5JYVWRZcIL3,chunk_overlap_strategy,"The article does not address the criterion of 'Chunk Overlap and Context Preservation' at all. There are no discussions or mentions of chunk overlap strategies, parameters, or their benefits, which are essential for meeting this criterion.","To improve the article, the authors should include a section that discusses chunk overlap strategies, specifies overlap parameters, and explains the rationale behind their implementation.",1,0
a5JYVWRZcIL3,query_processing_optimization,"The article effectively discusses various techniques related to retrieval optimization, including query embedding, similarity search, context formatting, and relevance filtering. These elements align well with the criterion for Query Processing and Optimization, demonstrating a comprehensive understanding of the subject matter.",It is recommended to accept this article as it meets the criterion for Query Processing and Optimization.,1,1
a5JYVWRZcIL3,document_ingestion_process,"The article lacks essential details regarding document selection, preprocessing steps, and chunking strategies, which are critical for meeting the Document Ingestion and Processing criterion. While it mentions embedding generation, this alone is insufficient to satisfy the requirements.","To improve the article, it should include comprehensive information on how documents are selected, the preprocessing methods applied, and the strategies used for chunking the documents.",1,0
a5JYVWRZcIL3,model_selection,"The article mentions the use of OpenAI's latest models with specialized prompting but fails to provide a clear rationale for the selection of this specific model. There is no discussion of how the model's capabilities align with the requirements of literary analysis, which is essential for justifying its use in the RAG pipeline.","To improve the article, it should include a detailed explanation of why this model was chosen, highlighting its strengths and relevance to the task at hand.",1,0
a5JYVWRZcIL3,vector_store_implementation,"The article provides a clear mention of the vector store used (ChromaDB) and explains the rationale behind its selection, including benefits such as file-based persistence and reduced re-indexing overhead. Additionally, it includes configuration details with a code snippet, demonstrating a solid understanding of the vector store's purpose in the context of the RAG architecture.",The article meets the criterion for Vector Store Selection and Configuration. It is recommended to maintain this level of detail in future sections to ensure clarity and comprehensiveness.,1,1
a5JYVWRZcIL3,agentic_patterns_implementation,"The article demonstrates a clear understanding of advanced agentic patterns and structured reasoning frameworks through its discussion of Retrieval-Augmented Generation (RAG) systems. It effectively outlines systematic approaches to prompt engineering and multi-stage document processing, which are indicative of a sophisticated application of these concepts.",Continue to emphasize the advanced reasoning frameworks and structured patterns in future discussions or presentations to highlight the article's contributions to the field of agentic AI.,1,1
a5JYVWRZcIL3,prompt_engineering_implementation,"The article provides a clear implementation of prompt engineering techniques, including specific prompt templates, context integration, and role definition, which are essential components of effective prompt engineering.",The article should be considered as meeting the criterion for Clear Prompt Engineering Implementation.,1,1
a5JYVWRZcIL3,embedding_model_selection,"The article clearly identifies the embedding model used ('all-MiniLM-L6-v2') and provides a solid rationale for its selection, including performance benefits and cost optimization. It demonstrates an understanding of the model's capabilities in a domain-specific context, which aligns with the criterion for Embedding Model Selection and Configuration.",The article should be considered for publication as it meets the necessary criterion effectively.,1,1
a5JYVWRZcIL3,rag_implementation,"The article effectively demonstrates the implementation of Retrieval-Augmented Generation (RAG) architecture by integrating document retrieval with language model generation. It discusses the use of a hybrid retrieval system, persistent vector architecture, and context retrieval from a knowledge base, all of which are essential components of RAG systems.",The article meets the criterion for RAG Implementation and should be considered compliant.,1,1
a5JYVWRZcIL3,rag_architecture_explanation,"The article provides a comprehensive overview of the RAG architecture, detailing the document processing stages, the vector store used (ChromaDB), the embedding model (Sentence Transformer), and the retrieval mechanism (cosine similarity). Each component is well-explained, demonstrating a clear understanding of the architecture and its implementation.",I recommend accepting the article as it meets the criterion for RAG Architecture Implementation Details.,1,1
a5JYVWRZcIL3,similarity_search_configuration,"The article provides a clear mention of the similarity metrics used, specifically 'ChromaDB cosine similarity', and details the algorithms and methods employed, such as 'local sentence transformer embeddings'. It also specifies basic search parameters like 'top_k' and 'score_threshold', demonstrating a comprehensive understanding of similarity search mechanisms.",The article meets the criterion for similarity search and retrieval configuration. It is well-documented and effectively outlines the necessary components for understanding the search process.,1,1
a5JYVWRZcIL3,retrieval_evaluation_metrics,"The article discusses relevant performance metrics such as 'Retrieval Latency' and 'Relevance Filtering', which are important for evaluating retrieval performance. Additionally, it includes practical logging of retrieved documents, indicating an understanding of performance monitoring.","To enhance the article, it could include a more detailed evaluation methodology and formal testing approaches to provide a comprehensive view of retrieval performance.",1,1
a5JYVWRZcIL3,project_scope_clarity,"The article provides a comprehensive overview of the RAG assistant's implementation, clearly defining its domain specialization in the literary works of Jorge Luis Borges. It outlines specific use cases, target queries, and the capabilities of the assistant, demonstrating a thorough understanding of the project scope.",The article is well-structured and meets the criterion for RAG Project Scope Definition. It is recommended for publication as it contributes valuable insights into domain-specialized AI applications in literary analysis.,1,1
O0NZPilG88oo,query_processing_optimization,"The article does not contain any relevant content or discussions regarding query processing techniques, query preprocessing, enhancement strategies, or optimization techniques. As such, it fails to address the criterion effectively.","To improve the article, it is recommended that the authors include sections that specifically discuss query processing methods, optimization strategies, and any relevant enhancements to meet the criterion.",1,0
O0NZPilG88oo,text_chunking_strategy,"The article does not provide any information regarding the text chunking strategy and implementation for the RAG system. Key details such as chunk size, overlap parameters, and the overall chunking approach are missing, which are essential to meet the criterion.","It is recommended that the authors revise the article to include a dedicated section that outlines the text chunking strategy, including specific parameters and methods used in the implementation.",1,0
O0NZPilG88oo,prompt_engineering_implementation,"The article does not provide any content that demonstrates clear prompt engineering implementation. There are no examples of prompt templates, context integration, or documentation of prompt design strategies, which are essential to meet the criterion.","To improve the article, the authors should include specific sections that showcase prompt engineering techniques, such as detailed examples of prompts used, how context from retrieved documents is integrated, and a clear explanation of their prompt design strategies.",1,0
O0NZPilG88oo,vector_store_implementation,"The article does not provide any paragraphs that discuss the vector store selection or configuration. Without this critical information, it fails to meet the criterion for Vector Store Selection and Configuration.","To improve the article, it should include detailed sections that explain the choice of vector store, the reasons behind that choice, and any relevant configuration settings.",1,0
O0NZPilG88oo,similarity_search_configuration,"The article does not contain any content related to similarity search mechanisms for document retrieval. There are no discussions on similarity metrics, search algorithms, or basic search parameters, which are essential for meeting the criterion.","To improve the article, the authors should include sections that specifically address similarity search mechanisms, detailing relevant metrics, algorithms, and parameters.",1,0
O0NZPilG88oo,memory_and_reasoning,"The article does not contain any sections discussing memory mechanisms or reasoning capabilities, which are essential for meeting the criterion. There are no mentions of conversation history management, context persistence, or multi-step reasoning approaches, indicating a lack of implementation in these areas.","To improve the article's compliance with the criterion, the authors should include detailed discussions on memory mechanisms and reasoning capabilities, as well as documentation of any strategies implemented.",1,0
O0NZPilG88oo,retrieval_evaluation_metrics,"The article does not contain any relevant content regarding retrieval performance evaluation and metrics. There are no sections or paragraphs that discuss retrieval accuracy, evaluation methodologies, or performance testing, which are essential for meeting the criterion.","To improve the article, the authors should include detailed sections that address retrieval performance evaluation, including specific metrics and methodologies used for testing and measuring retrieval effectiveness.",1,0
O0NZPilG88oo,embedding_model_selection,"The article does not provide any information regarding the embedding model used, its selection rationale, or its capabilities. Without this critical information, it fails to meet the criterion for embedding model selection and configuration.","To improve the article, it should include detailed descriptions of the embedding model utilized, the reasons for its selection, and any relevant capabilities or configurations.",1,0
O0NZPilG88oo,document_ingestion_process,"The article does not provide any information regarding the process of ingesting and preparing documents for the vector store. There are no details on document selection, preprocessing steps, chunking strategies, or embedding generation, which are essential for meeting the criterion.","To improve the article, the authors should include comprehensive sections that detail the document ingestion process, including selection criteria, preprocessing methods, and embedding techniques.",1,0
O0NZPilG88oo,model_selection,"The article does not provide any paragraphs that discuss the selection of a specific language model (LLM) for response generation. There is no rationale given for the choice of model, nor is there any information about the model's capabilities. Without this critical information, the article fails to meet the criterion for model selection documentation.","To improve the article, it should include detailed sections that specify the LLM used, explain the rationale behind its selection, and discuss its capabilities in relation to the RAG-powered assistant.",1,0
O0NZPilG88oo,rag_architecture_explanation,"The article does not provide any paragraphs or content that detail the RAG architecture implementation, including the retrieval mechanism, vector store choice, and document processing. Without this critical information, it cannot be determined that the article meets the criterion.","To improve the article, the authors should include comprehensive sections that explain the RAG architecture, detailing the retrieval mechanism, the choice of vector store, and the document processing methods used. This will help fulfill the requirements of the criterion.",1,0
O0NZPilG88oo,chunk_overlap_strategy,"The article effectively discusses chunk overlap strategies, providing clear details on implementation, parameters, and rationale. It demonstrates a comprehensive understanding of how to maintain context continuity across document segments, which is essential for the criterion.",Continue to emphasize the importance of context preservation in future articles and consider including examples of practical applications of chunk overlap strategies.,1,1
O0NZPilG88oo,rag_implementation,"The article does not contain any content that addresses the criterion for RAG Implementation. There are no sections discussing document retrieval, LLM generation, or vector storage, which are essential components of Retrieval-Augmented Generation architecture.","To improve the article's compliance with the RAG criteria, the authors should include detailed descriptions of the retrieval and generation processes, as well as any relevant methodologies or technologies used in their implementation.",1,0
O0NZPilG88oo,guardrails_implementation,"The article does not address any safety guardrails or content filtering mechanisms, which are essential for meeting the criterion. There are no sections that discuss safety considerations or measures to prevent harmful outputs, indicating a lack of attention to safety protocols.","It is recommended that the article be revised to include comprehensive discussions on safety guardrails, input validation, and content moderation strategies to ensure compliance with safety standards.",1,0
O0NZPilG88oo,project_scope_clarity,"The article does not provide any relevant information regarding the RAG Project Scope Definition. There are no sections or paragraphs that outline the implementation, intended use case, document domain, knowledge base, or capabilities of the RAG assistant. Without this critical information, the article fails to meet the criterion.","To improve the article, the authors should include comprehensive details about the RAG assistant's implementation, its intended use cases, the specific document domain it addresses, the knowledge base it utilizes, and the capabilities it offers. This will help fulfill the requirements of the RAG Project Scope Definition.",1,0
O0NZPilG88oo,agentic_patterns_implementation,"The article does not contain any content that addresses the criterion of Agentic Patterns and Frameworks Usage. There are no structured reasoning patterns or systematic frameworks discussed, which are essential for meeting this criterion.","To improve the article, it is recommended that the authors include sections that explicitly discuss agentic patterns and frameworks, providing examples and structured reasoning to align with the expectations of the criterion.",1,0
00LAGp5OuigT,guardrails_implementation,"The article does not address any aspects of Guardrails and Safety Measures. There are no mentions of safety guardrails, content filtering mechanisms, or any basic safety considerations that are necessary to prevent harmful outputs or handle inappropriate queries. Without this critical information, the article fails to meet the criterion.","It is recommended that the authors revise the article to include comprehensive discussions on safety measures, including input validation, content moderation, and output filtering, to ensure compliance with the criterion.",1,0
00LAGp5OuigT,embedding_model_selection,"The article does not provide any paragraphs or content related to the selection and configuration of embedding models, which is essential for meeting the criterion. Without this information, it is impossible to assess the appropriateness or effectiveness of the embedding model used in the context of the article.","To improve the article, the authors should include detailed descriptions of the embedding model they selected, the reasons for their choice, and any relevant configurations or parameters that were utilized. This will help in meeting the criterion in future evaluations.",1,0
00LAGp5OuigT,model_selection,The article fails to explicitly name the specific language model (LLM) used in the RAG pipeline and does not provide a rationale for its selection. This lack of detail is critical for understanding the effectiveness and appropriateness of the model in the context of the system described.,"Revise the article to include the specific LLM used, along with a clear rationale for its selection and a discussion of its capabilities in relation to the RAG pipeline.",1,0
00LAGp5OuigT,vector_store_implementation,"The article mentions FAISS as the vector store but fails to provide a rationale for its selection, configuration details, or its intended purpose within the RAG system. This lack of information does not satisfy the criterion requirements.","To improve the article, the authors should include a detailed explanation of why FAISS was chosen, how it will be configured, and its role in the retrieval component of the RAG system.",1,0
00LAGp5OuigT,query_processing_optimization,"The article provides clear insights into query processing through its description of the RAG pipeline, which includes user query retrieval and response generation. Additionally, it discusses performance tuning parameters that are essential for query optimization, fulfilling the requirements of the criterion.","To further enhance the article, consider explicitly labeling the sections on query processing and optimization to improve clarity for readers.",1,1
00LAGp5OuigT,similarity_search_configuration,"The article effectively discusses various aspects of similarity search and retrieval configuration, including keyword-based search mechanisms, relevance scoring, and performance tuning parameters. It also indicates future enhancements with advanced algorithms, demonstrating a comprehensive understanding of the topic.",Continue to expand on the integration of advanced search techniques and provide more examples of practical applications to further strengthen the discussion.,1,1
00LAGp5OuigT,prompt_engineering_implementation,"The article fails to provide any examples of prompt templates or demonstrate how context from retrieved documents is integrated into the responses. It lacks clarity in prompt engineering, as there are no system messages or role definitions mentioned, and the overall approach to prompt design is not documented. These deficiencies indicate that the article does not meet the criterion for clear prompt engineering implementation.","To improve, the article should include specific examples of prompts, detail the integration of context from retrieved documents, and document the strategies used in prompt design.",1,0
00LAGp5OuigT,text_chunking_strategy,The article clearly specifies the chunk size as 1500 characters and describes the chunking method used through the 'Chunking Engine'. This meets the requirements of the criterion regarding text chunking strategy and implementation.,The article should be considered compliant with the criterion as it provides sufficient detail on chunking implementation.,1,1
00LAGp5OuigT,chunk_overlap_strategy,"The article fails to address any aspect of chunk overlap, which is crucial for maintaining context continuity in document processing. It does not mention overlap strategies, parameters, or the rationale behind their use, indicating a significant gap in the discussion of context preservation.","To improve, the article should include a detailed explanation of chunk overlap strategies, specify any parameters related to overlap, and provide a rationale for their implementation. This would enhance the understanding of how to maintain context across document segments.",1,0
00LAGp5OuigT,rag_architecture_explanation,"The article provides a comprehensive overview of the RAG pipeline architecture, including details on document processing, retrieval mechanisms, and integration with language models. It effectively describes the chunking process and the overall system architecture, which are essential components of the RAG implementation.","While the article meets the criterion, it could enhance clarity by explicitly naming the vector store used in the implementation. This addition would provide a more complete understanding of the architecture.",1,1
00LAGp5OuigT,retrieval_evaluation_metrics,"The article provides a clear evaluation of retrieval performance, including specific metrics such as accuracy (92%) and details on the evaluation methodology (manual evaluation of sample queries). It also discusses response time and scalability, which are relevant to retrieval performance.",The article meets the criterion for Retrieval Performance Evaluation and Metrics. It effectively documents the evaluation process and presents relevant performance metrics.,1,1
00LAGp5OuigT,rag_implementation,"The article effectively describes the integration of document retrieval and language model generation, which are key components of the RAG architecture. It outlines the use of a RAG pipeline that processes user queries to retrieve relevant documents and generate coherent responses, demonstrating a clear understanding of the RAG framework.",The article meets the criterion for RAG Implementation and should be considered compliant.,1,1
00LAGp5OuigT,memory_and_reasoning,"The article fails to adequately address the necessary components of Memory and Reasoning Implementation. It lacks specific details on memory mechanisms, conversation history management, and reasoning capabilities, which are critical for meeting the criterion.","To improve, the authors should provide comprehensive documentation on how memory is integrated, how conversation context is maintained across interactions, and detail the reasoning strategies employed by the RAG assistant.",1,0
00LAGp5OuigT,project_scope_clarity,"The article provides a clear and detailed overview of the RAG assistant's implementation, including its document domain, knowledge base, and intended use cases. It effectively outlines the capabilities of the assistant and the rationale behind the choice of document set, which aligns with the criterion for RAG Project Scope Definition.",The article should be considered as meeting the criterion.,1,1
00LAGp5OuigT,document_ingestion_process,"The article provides a clear overview of the document ingestion and processing steps, including document selection, preprocessing, and chunking strategy. These elements are essential for preparing documents for a vector store, and the article addresses them effectively.",I recommend accepting the article as it meets the criterion for Document Ingestion and Processing.,1,1
